Titre,Titre_original,Annee,Public,Duree,Note,Type,Description,Actors,Country,Langue
Le salaire de la peur,,1953,Tous Public,"2,h, ,36,m",8.1,"Adventure,Drama,Thriller","In a decrepit South American village, four men are hired to transport an urgent nitroglycerine shipment without the equipment that would make it safe.","Yves Montand,Charles Vanel,Peter van Eyck,Folco Lulli,Véra Clouzot,William Tubbs,Darío Moreno,Jo Dest,Antonio Centa,Luis De Lima,Grégoire Gromoff,Josep Palau i Fabre,Faustini,Seguna,Darling Légitimus,René Baranger,Pat Hurst,Evelio Larenagas",France,"French,English,Spanish,German,Italian,Russian"
Million Dollar Baby,,2004,Tous publics,"2,h, ,12,m",8.1,"Drama,Sport",A determined woman works with a hardened boxing trainer to become a professional.,"Hilary Swank,Clint Eastwood,Morgan Freeman,Jay Baruchel,Mike Colter,Lucia Rijker,Brían F. O'Byrne,Anthony Mackie,Margo Martindale,Riki Lindhome,Michael Peña,Benito Martinez,Bruce MacVittie,David Powledge,Joe D'Angerio,Marcus Chait,Tom McCleister,Erica Grant",United States,"English,Irish Gaelic"
Harry Potter et les Reliques de la Mort 2ème partie,Original title: Harry Potter and the Deathly Hallows: Part 2,2011,Tous publics,"2,h, ,10,m",8.1,"Adventure,Fantasy,Mystery","Harry, Ron, and Hermione search for Voldemort's remaining Horcruxes in their effort to destroy the Dark Lord as the final battle rages on at Hogwarts.","Daniel Radcliffe,Emma Watson,Rupert Grint,Michael Gambon,Ralph Fiennes,Alan Rickman,Evanna Lynch,Domhnall Gleeson,Clémence Poésy,Warwick Davis,John Hurt,Helena Bonham Carter,Graham Duff,Anthony Allgood,Rusty Goffe,Jon Key,Kelly Macdonald,Jason Isaacs",United Kingdom,"English,Latin"
Ben-Hur,,1959,Tous publics,"3,h, ,32,m",8.1,"Adventure,Drama,History","After a Jewish prince is betrayed and sent into slavery by a Roman friend in 1st-century Jerusalem, he regains his freedom and comes back for revenge.","Charlton Heston,Jack Hawkins,Stephen Boyd,Haya Harareet,Hugh Griffith,Martha Scott,Cathy O'Donnell,Sam Jaffe,Finlay Currie,Frank Thring,Terence Longdon,George Relph,André Morell,Fortunato Arena,Bruno Ariè,Les Ballets Africains,Emma Baron,Ady Berber",United States,English
Mad Max: Fury Road,,2015,Tous publics avec avertissement,"2,h",8.1,"Action,Adventure,Sci-Fi","In a post-apocalyptic wasteland, a woman rebels against a tyrannical ruler in search for her homeland with the aid of a group of female prisoners, a psychotic worshiper, and a drifter named Max.","Tom Hardy,Charlize Theron,Nicholas Hoult,Zoë Kravitz,Hugh Keays-Byrne,Josh Helman,Nathan Jones,Rosie Huntington-Whiteley,Riley Keough,Abbey Lee,Courtney Eaton,John Howard,Richard Carter,Iota,Angus Sampson,Jennifer Hagan,Megan Gale,Melissa Jaffer",Australia,"English,Russian"
Le Cercle des poètes disparus,Original title: Dead Poets Society,1989,Tous publics,"2,h, ,8,m",8.1,"Comedy,Drama",Maverick teacher John Keating uses poetry to embolden his boarding school students to new heights of self-expression.,"Robin Williams,Robert Sean Leonard,Ethan Hawke,Josh Charles,Gale Hansen,Dylan Kussman,Allelon Ruggiero,James Waterston,Norman Lloyd,Kurtwood Smith,Carla Belver,Leon Pownall,George Martin,Joe Aufiery,Matt Carey,Kevin Cooney,Jane Moore,Lara Flynn Boyle",United States,"English,Latin"
Dragons,Original title: How to Train Your Dragon,2010,Tous publics,"1,h, ,38,m",8.1,"Animation,Action,Adventure","A hapless young Viking who aspires to hunt dragons becomes the unlikely friend of a young dragon himself, and learns there may be more to the creatures than he assumed.","Jay Baruchel,Gerard Butler,Christopher Mintz-Plasse,Craig Ferguson,America Ferrera,Jonah Hill,T.J. Miller,Kristen Wiig,Robin Atkin Downes,Philip McGrade,Kieron Elliott,Ashley Jensen,David Tennant",United States,English
Sonate d'automne,Original title: Höstsonaten,1978,Tous publics,"1,h, ,39,m",8.2,"Drama,Music","A devoted wife is visited by her mother, a successful concert pianist who had little time for her when she was young.","Ingrid Bergman,Liv Ullmann,Lena Nyman,Halvar Björk,Marianne Aminoff,Arne Bang-Hansen,Gunnar Björnstrand,Erland Josephson,Georg Løkkeberg,Mimi Pollak,Linn Ullmann,Eva von Hanno,Knut Wigert",West Germany,"Swedish,English"
The Big Lebowski,,1998,Tous publics,"1,h, ,57,m",8.1,"Comedy,Crime,Sport","Ultimate L.A. slacker Jeff ""The Dude"" Lebowski, mistaken for a millionaire of the same name, seeks restitution for a rug ruined by debt collectors, enlisting his bowling buddies for help while trying to find the millionaire's missing wife.","Jeff Bridges,John Goodman,Julianne Moore,Steve Buscemi,David Huddleston,Philip Seymour Hoffman,Tara Reid,Philip Moon,Mark Pellegrino,Peter Stormare,Flea,Torsten Voges,Jimmie Dale Gilmore,Jack Kehler,John Turturro,James G. Hoosier,Carlos Leon,Terrence Burton",United States,"English,German,Hebrew,Spanish"
Jeux dangereux,Original title: To Be or Not to Be,1942,Tous publics,"1,h, ,39,m",8.2,"Comedy,Romance,War","During the Nazi occupation of Poland, an acting troupe becomes embroiled in a Polish soldier's efforts to track down a German spy.","Carole Lombard,Jack Benny,Robert Stack,Felix Bressart,Lionel Atwill,Stanley Ridges,Sig Ruman,Tom Dugan,Charles Halton,George Lynn,Henry Victor,Maude Eburne,Halliwell Hobbes,Miles Mander,Rudolph Anders,Paul Barrett,Sven Hugo Borg,Danny Borzage",United States,"English,German"
12 Years a Slave,,2013,Tous publics avec avertissement,"2,h, ,14,m",8.1,"Biography,Drama,History","In the antebellum United States, Solomon Northup, a free black man from upstate New York, is abducted and sold into slavery.","Chiwetel Ejiofor,Michael Kenneth Williams,Michael Fassbender,Brad Pitt,Dwight Henry,Dickie Gravois,Bryan Batt,Ashley Dyke,Kelsey Scott,Quvenzhané Wallis,Cameron Zeigler,Tony Bentley,Scoot McNairy,Taran Killam,Christopher Berry,Bill Camp,Mister Mackey Jr.,Chris Chalk",United States,English
Le Mans '66,Original title: Ford v Ferrari,2019,Tous publics,"2,h, ,32,m",8.1,"Action,Biography,Drama",American car designer Carroll Shelby and driver Ken Miles battle corporate interference and the laws of physics to build a revolutionary race car for Ford in order to defeat Ferrari at the 24 Hours of Le Mans in 1966.,"Matt Damon,Christian Bale,Jon Bernthal,Caitriona Balfe,Josh Lucas,Noah Jupe,Tracy Letts,Remo Girone,Ray McKinnon,JJ Feild,Jack McMullen,Corrado Invernizzi,Joe Williamson,Ian Harding,Christopher Darga,Shawn Law,Emil Beheshti,Darrin Prescott",United States,"English,Italian,French,Japanese"
Andhadhun,,2018,Not Rated,"2,h, ,19,m",8.2,"Crime,Drama,Music","A series of mysterious events change the life of a blind pianist, who must now report a crime that he should technically know nothing of.","Ayushmann Khurrana,Tabu,Radhika Apte,Anil Dhawan,Manav Vij,Ashwini Kalsekar,Chhaya Kadam,Zakir Hussain,Rashmi Agdekar,Abhishek Shukla,Mohini Kewalramani,Nikitasha Kapoor,Saumin Patel,Hera Sajid,Abhishek Anand,Vishal Bajaj,Yogesh Chandekar,Rahul Gajjal",India,"Hindi,English"
La passion de Jeanne d'Arc,,1928,Not Rated,"1,h, ,50,m",8.1,"Biography,Drama,History","In 1431, Jeanne d'Arc is placed on trial on charges of heresy. The ecclesiastical jurists attempt to force Jeanne to recant her claims of holy visions.","Maria Falconetti,Eugene Silvain,André Berley,Maurice Schutz,Antonin Artaud,Michel Simon,Jean d'Yd,Louis Ravet,Armand Lurville,Jacques Arnna,Alexandre Mihalesco,Léon Larive,Jean Aymé,Gilbert Dacheux,Gilbert Dalleu,Paul Delauzac,Dimitri Dimitriev,Fournez-Goffard",France,"None,French"
Tu ne tueras point,Original title: Hacksaw Ridge,2016,12,"2,h, ,19,m",8.1,"Biography,Drama,History","World War II American Army Medic Desmond T. Doss, who served during the Battle of Okinawa, refuses to kill people and becomes the first man in American history to receive the Medal of Honor without firing a shot.","Andrew Garfield,Sam Worthington,Luke Bracey,Teresa Palmer,Richard Pyros,Jacob Warner,Milo Gibson,Darcy Bryce,Roman Guerriero,James Lugton,Kasia Stelmach,Hugo Weaving,Rachel Griffiths,Jarin Towney,Tim McGarry,Tyler Coppin,Richard Platt,Nathaniel Buzolic",Australia,"English,Japanese"
Gone Girl,,2014,Tous publics avec avertissement,"2,h, ,29,m",8.1,"Drama,Mystery,Thriller","With his wife's disappearance having become the focus of an intense media circus, a man sees the spotlight turned on him when it's suspected that he may not be innocent.","Ben Affleck,Rosamund Pike,Neil Patrick Harris,Tyler Perry,Carrie Coon,Kim Dickens,Patrick Fugit,David Clennon,Lisa Banes,Missi Pyle,Emily Ratajkowski,Casey Wilson,Lola Kirke,Boyd Holbrook,Sela Ward,Lee Norris,Jamie McShane,Leonard Kelly-Young",United States,English
96,,2018,Tous Public,"2,h, ,38,m",8.6,"Drama,Romance",Two high school sweethearts meet at a reunion after 22 years and reminisce about their past.,"Vijay Sethupathi,Adithya Bhaskar,Trisha Krishnan,Gouri Kishan,Devadarshini Chetan,Niyathi Kadambi,Janakaraj,Bagavathi Perumal,Surya,Rajkumar,Murugadass,Gowthamraj,Varsha Bollamma,Kavithalaya Krishnan,Shyam Prasad",India,Tamil
Barry Lyndon,,1975,Tous publics,"3,h, ,5,m",8.1,"Adventure,Drama,History",An Irish rogue wins the heart of a rich widow and assumes her dead husband's aristocratic position in 18th-century England.,"Ryan O'Neal,Marisa Berenson,Patrick Magee,Hardy Krüger,Steven Berkoff,Gay Hamilton,Marie Kean,Diana Körner,Murray Melvin,Frank Middlemass,André Morell,Arthur O'Sullivan,Godfrey Quigley,Leonard Rossiter,Philip Stone,Leon Vitali,John Bindon,Roger Booth",United Kingdom,"English,German,French"
Au nom du père,Original title: In the Name of the Father,1993,Tous publics,"2,h, ,13,m",8.1,"Biography,Crime,Drama",A man's coerced confession to an I.R.A. bombing he did not commit results in the imprisonment of his father as well. An English lawyer fights to free them.,"Daniel Day-Lewis,Pete Postlethwaite,Alison Crosbie,Philip King,Emma Thompson,Nye Heron,Anthony Brophy,Frankie McCafferty,Paul Warriner,Julian Walsh,Stuart Wolfenden,Jo Connor,Karen Carlisle,Seamus Moran,Billy Byrne,Maureen McBride,Jane Nolan,Laurence Griffin",Ireland,English
Arrête-moi si tu peux,Original title: Catch Me If You Can,2002,Tous publics,"2,h, ,21,m",8.1,"Biography,Crime,Drama","Barely 21 yet, Frank is a skilled forger who has passed as a doctor, lawyer and pilot. FBI agent Carl becomes obsessed with tracking down the con man, who only revels in the pursuit.","Leonardo DiCaprio,Tom Hanks,Christopher Walken,Martin Sheen,Nathalie Baye,Amy Adams,James Brolin,Brian Howe,Frank John Hughes,Steve Eastin,Chris Ellis,John Finn,Jennifer Garner,Nancy Lenehan,Ellen Pompeo,Elizabeth Banks,Guy Thauvette,Candice Azzara",United States,"English,French"
Room,,2015,Tous publics,"1,h, ,58,m",8.1,"Drama,Thriller","Held captive for 7 years in an enclosed space, a woman and her young son finally gain their freedom, allowing the boy to experience the outside world for the first time.","Brie Larson,Jacob Tremblay,Sean Bridgers,Wendy Crewson,Sandy McMaster,Matt Gordon,Amanda Brugel,Joe Pingue,Joan Allen,Zarrin Darnell-Martin,Cas Anvar,William H. Macy,Jee-Yun Lee,Randal Edwards,Justin Mader,Ola Sturik,Rodrigo Fernandez-Stoll,Rory O'Shea",Canada,English
Mr. Smith au sénat,Original title: Mr. Smith Goes to Washington,1939,(Banned),"2,h, ,9,m",8.1,"Comedy,Drama","A naive youth leader is appointed to fill a vacancy in the U.S. Senate. His idealistic plans promptly collide with corruption at home and subterfuge from his hero in Washington, but he tries to forge ahead despite attacks on his character.","James Stewart,Jean Arthur,Claude Rains,Edward Arnold,Guy Kibbee,Thomas Mitchell,Eugene Pallette,Beulah Bondi,H.B. Warner,Harry Carey,Astrid Allwyn,Ruth Donnelly,Grant Mitchell,Porter Hall,H.V. Kaltenborn,Charles Lane,Pierre Watkin,Dick Elliott",United States,English
Mary et Max.,Original title: Mary and Max.,2009,Tous Public,"1,h, ,32,m",8.1,"Animation,Comedy,Drama","A tale of friendship between two unlikely pen pals: Mary, a lonely, eight-year-old girl living in the suburbs of Melbourne, and Max, a forty-four-year old, severely obese man living in New York.","Toni Collette,Philip Seymour Hoffman,Eric Bana,Barry Humphries,Christopher Massey,Oliver Marks,Daisy Kocher,Daniel Marks,Hamish Hughes,Dan Doherty,Julie Forsyth,Mandy Mao,Patrick McCabe,Adam Elliot,Mr. Peck,Michael James Allen,Bill Murphy,Shaun Patten",Australia,"English,Yiddish"
Before Sunrise,,1995,Tous publics,"1,h, ,41,m",8.1,"Drama,Romance","A young man and woman meet on a train in Europe, and wind up spending one evening together in Vienna. Unfortunately, both know that this will probably be their only night together.","Ethan Hawke,Julie Delpy,Andrea Eckert,Hanno Pöschl,Karl Bruckschwaiger,Tex Rubinowitz,Erni Mangold,Dominik Castell,Haymon Maria Buttinger,Harald Waiglein,Bilge Jeschim,Kurti,Hans Weingartner,Liese Lyon,Peter Ily Huemer,Otto Reiter,Hubert Fabian Kulterer,Branko Andric",United States,"English,German,French"
Sherlock Junior,Original title: Sherlock Jr.,1924,Tous publics,"45,m",8.2,"Action,Comedy,Romance","A film projectionist longs to be a detective, and puts his meagre skills to work when he is framed by a rival for stealing his girlfriend's father's pocketwatch.","Buster Keaton,Kathryn McGuire,Joe Keaton,Erwin Connelly,Ward Crane,Jane Connelly,George Davis,Doris Deane,Christine Francis,Betsy Ann Hisle,Kewpie Morgan,Steve Murphy,John Patrick,Ford West",United States,"None,English"
Persona,,1966,Tous publics,"1,h, ,25,m",8.1,"Drama,Thriller",A nurse is put in charge of a mute actress and finds that their personae are melding together.,"Bibi Andersson,Liv Ullmann,Margaretha Krook,Gunnar Björnstrand,Jörgen Lindström",Sweden,"Swedish,English"
Gran Torino,,2008,Tous publics,"1,h, ,56,m",8.1,Drama,"Disgruntled Korean War veteran Walt Kowalski sets out to reform his neighbor, Thao Lor, a Hmong teenager who tried to steal Kowalski's prized possession: a 1972 Gran Torino.","Clint Eastwood,Bee Vang,Christopher Carley,Ahney Her,Brian Haley,Geraldine Hughes,Dreama Walker,Brian Howe,John Carroll Lynch,William Hill,Brooke Chia Thao,Chee Thao,Choua Kue,Scott Eastwood,Xia Soua Chang,Sonny Vue,Doua Moua,Greg Trzaskoma",Germany,"English,Hmong"
Le mécano de la Générale,Original title: The General,1926,Tous publics,"1,h, ,7,m",8.1,"Action,Adventure,Comedy","After being rejected by the Confederate military, not realizing it was due to his crucial civilian role, an engineer must single-handedly recapture his beloved locomotive after it is seized by Union spies and return it through enemy lines.","Buster Keaton,Marion Mack,Glen Cavender,Jim Farley,Frederick Vroom,Frank Barnes,Charles Henry Smith,Joe Keaton,Mike Donlin,Tom Nawn,Henry Baird,Joe Bricher,Jimmy Bryant,Sergeant Bukowski,C.C. Cruson,Jack Dempster,Keith Fennell,Budd Fine",United States,English
The Grand Budapest hotel,Original title: The Grand Budapest Hotel,2014,Tous publics,"1,h, ,39,m",8.1,"Adventure,Comedy,Crime","A writer encounters the owner of an aging high-class hotel, who tells him of his early years serving as a lobby boy in the hotel's glorious years under an exceptional concierge.","Ralph Fiennes,F. Murray Abraham,Mathieu Amalric,Adrien Brody,Willem Dafoe,Jeff Goldblum,Harvey Keitel,Jude Law,Bill Murray,Edward Norton,Saoirse Ronan,Jason Schwartzman,Léa Seydoux,Tilda Swinton,Tom Wilkinson,Owen Wilson,Tony Revolori,Larry Pine",United States,"English,French,German"
Prisoners,,2013,12,"2,h, ,33,m",8.1,"Crime,Drama,Mystery","When Keller Dover's daughter and her friend go missing, he takes matters into his own hands as the police pursue multiple leads and the pressure mounts.","Hugh Jackman,Jake Gyllenhaal,Viola Davis,Melissa Leo,Maria Bello,Terrence Howard,Paul Dano,Dylan Minnette,Zoë Soul,Erin Gerasimovich,Kyla-Drew,Wayne Duvall,Len Cariou,David Dastmalchian,Brad James,Anthony Reynolds,Robert C. Treveiler,Sandra Ellis Lafferty",United States,English
Voyage au bout de l'enfer,Original title: The Deer Hunter,1978,12,"3,h, ,3,m",8.1,"Drama,War",An in-depth examination of the ways in which the Vietnam War impacts and disrupts the lives of several friends in a small steel mill town in Pennsylvania.,"Robert De Niro,Christopher Walken,John Cazale,John Savage,Meryl Streep,George Dzundza,Chuck Aspegren,Shirley Stoler,Rutanya Alda,Pierre Segui,Mady Kaplan,Amy Wright,Mary Ann Haenel,Richard Kuss,Joe Grifasi,Christopher Colombi Jr.,Victoria Karnafel,Jack Scardino",United States,"English,Vietnamese,French,Russian,Cantonese"
Z,,1969,Tous publics,"2,h, ,7,m",8.2,"Crime,Drama,History",The public murder of a prominent politician and doctor amid a violent demonstration is covered up by military and government officials. A tenacious magistrate is determined not to let them get away with it.,"Yves Montand,Irene Papas,Jean-Louis Trintignant,François Périer,Jacques Perrin,Charles Denner,Pierre Dux,Georges Géret,Bernard Fresson,Marcel Bozzuffi,Julien Guiomar,Magali Noël,Renato Salvatori,Habib Reda,Clotilde Joano,Maurice Baquet,Sid Ahmed Agoumi,Allel El Mouhib",France,"French,Russian,English"
Les Nouveaux Sauvages,Original title: Relatos salvajes,2014,Tous publics avec avertissement,"2,h, ,2,m",8.1,"Comedy,Drama,Thriller",Six short stories that explore the extremities of human behavior involving people in distress.,"Darío Grandinetti,María Marull,Mónica Villa,Diego Starosta,Marcelo Frasca,Lucila Mangone,María Laura Caccamo,Carlos Alberto Vavassori,Pablo Machado,Horacio Vay,Javier Pedersoli,Héctor Drachtman,María Rosa López Ottonello,Rita Cortese,Julieta Zylberberg,César Bordón,Juan Santiago Linari,Leonardo Sbaraglia",Argentina,Spanish
Stalker,,1979,Tous publics,"2,h, ,42,m",8.1,"Drama,Sci-Fi",A guide leads two men through an area known as the Zone to find a room that grants wishes.,"Alisa Freyndlikh,Aleksandr Kaydanovskiy,Anatoliy Solonitsyn,Nikolay Grinko,Natalya Abramova,Faime Jurno,E. Kostin,Raymo Rendi,Sergey Yakovlev,Vladimir Zamanskiy",Soviet Union,Russian
Mon père et mon fils,Original title: Babam ve Oglum,2005,Tous Public,"1,h, ,52,m",8.2,"Drama,Family",The family of a left-wing journalist is torn apart after the military coup of Turkey in 1980.,"Eser Sariyar,Çetin Tekindor,Fikret Kuskan,Hümeyra,Ege Tanman,Serif Sezer,Yetkin Dikinciler,Binnur Kaya,Mahmut Gökgöz,Nergis Çorakçi,Bilge Sen,Tuba Büyüküstün,Özge Özberk,Erdal Tosun,Halit Ergenç,Tugyan Akay Kavukçu,Ege Kaya,Muzaffer Demirel",Turkey,Turkish
Sur les quais...,Original title: On the Waterfront,1954,Tous publics,"1,h, ,48,m",8.1,"Crime,Drama,Thriller","An ex-prize fighter turned New Jersey longshoreman struggles to stand up to his corrupt union bosses, including his older brother, as he starts to connect with the grieving sister of one of the syndicate's victims.","Marlon Brando,Karl Malden,Lee J. Cobb,Rod Steiger,Pat Henning,Leif Erickson,James Westerfield,Tony Galento,Tami Mauriello,John F. Hamilton,John Heldabrand,Rudy Bond,Don Blackman,Arthur Keegan,Abe Simon,Eva Marie Saint,Martin Balsam,Dan Bergin",United States,English
Autant en emporte le vent,Original title: Gone with the Wind,1939,Tous publics,"3,h, ,58,m",8.1,"Drama,History,Romance",The manipulative daughter of a Georgia plantation owner conducts a turbulent romance with a roguish profiteer during the American Civil War and Reconstruction periods.,"Clark Gable,Vivien Leigh,Thomas Mitchell,Barbara O'Neil,Evelyn Keyes,Ann Rutherford,George Reeves,Fred Crane,Hattie McDaniel,Oscar Polk,Butterfly McQueen,Victor Jory,Everett Brown,Howard Hickman,Alicia Rhett,Leslie Howard,Olivia de Havilland,Rand Brooks",United States,English
Kill Bill: Volume I,Original title: Kill Bill: Vol. 1,2003,16,"1,h, ,51,m",8.1,"Action,Crime,Drama","After awakening from a four-year coma, a former assassin wreaks vengeance on the team of assassins who betrayed her.","Uma Thurman,David Carradine,Daryl Hannah,Michael Madsen,Lucy Liu,Vivica A. Fox,Julie Dreyfus,Chiaki Kuriyama,Shin'ichi Chiba,Chia-Hui Liu,Michael Parks,Michael Bowen,Jun Kunimura,Kenji Ohba,Yuki Kazamatsuri,James Parks,Sakichi Sato,Jonathan Loughran",United States,"English,Japanese,French"
Le Monde de Nemo,Original title: Finding Nemo,2003,Tous publics,"1,h, ,40,m",8.1,"Animation,Adventure,Comedy","After his son is captured in the Great Barrier Reef and taken to Sydney, a timid clownfish sets out on a journey to bring him home.","Albert Brooks,Ellen DeGeneres,Alexander Gould,Willem Dafoe,Brad Garrett,Allison Janney,Austin Pendleton,Stephen Root,Vicki Lewis,Joe Ranft,Geoffrey Rush,Andrew Stanton,Elizabeth Perkins,Nicholas Bird,Bob Peterson,Barry Humphries,Eric Bana,Bruce Spence",United States,English
Warrior,,2011,Tous publics,"2,h, ,20,m",8.1,"Action,Drama,Sport","The youngest son of an alcoholic former boxer returns home, where he's trained by his father for competition in a mixed martial arts tournament - a path that puts the fighter on a collision course with his estranged, older brother.","Tom Hardy,Nick Nolte,Joel Edgerton,Jennifer Morrison,Frank Grillo,Kevin Dunn,Maximiliano Hernández,Bryan Callen,Sam Sheridan,Fernando Chien,Jake McLaughlin,Vanessa Martinez,Denzel Whitaker,Carlos Miranda,Nick Lehane,Laura Chinn,Capri Thomas,Lexi Cowan",United States,"English,Spanish"
Fargo,,1996,12,"1,h, ,38,m",8.1,"Crime,Thriller",Minnesota car salesman Jerry Lundegaard's inept crime falls apart due to his and his henchmen's bungling and the persistent police work of the quite pregnant Marge Gunderson.,"William H. Macy,Frances McDormand,Steve Buscemi,Peter Stormare,Kristin Rudrüd,Harve Presnell,Tony Denman,Gary Houston,Sally Wingert,Kurt Schweickhardt,Larissa Kokernot,Melissa Peterman,Steve Reevis,Warren Keith,Steve Edelman,Sharon Anderson,Larry Brandenburg,James Gaulke",United States,English
Le pont de la rivière Kwaï,Original title: The Bridge on the River Kwai,1957,Tous publics,"2,h, ,41,m",8.1,"Adventure,Drama,War","British POWs are forced to build a railway bridge across the river Kwai for their Japanese captors in occupied Burma, not knowing that the allied forces are planning a daring commando raid through the jungle to destroy it.","William Holden,Alec Guinness,Jack Hawkins,Sessue Hayakawa,James Donald,Geoffrey Horne,André Morell,Peter Williams,John Boxer,Percy Herbert,Harold Goodwin,Ann Sears,Heihachirô Ôkawa,Keiichirô Katsumoto,M.R.B. Chakrabandhu,Vilaiwan Seeboonreaung,Ngamta Suphaphongs,Javanart Punynchoti",United Kingdom,"English,Japanese,Thai"
Trainspotting,,1996,16,"1,h, ,33,m",8.1,Drama,"Renton, deeply immersed in the Edinburgh drug scene, tries to clean up and get out, despite the allure of the drugs and influence of friends.","Ewan McGregor,Ewen Bremner,Jonny Lee Miller,Kevin McKidd,Robert Carlyle,Kelly Macdonald,Peter Mullan,James Cosmo,Eileen Nicholas,Susan Vidler,Pauline Lynch,Shirley Henderson,Stuart McQuarrie,Irvine Welsh,Dale Winton,Keith Allen,Kevin Allen,Annie Louise Ross",United Kingdom,English
Voyage à Tokyo,Original title: Tôkyô monogatari,1953,Tous publics,"2,h, ,16,m",8.2,Drama,"An old couple visit their children and grandchildren in the city, but receive little attention.","Chishû Ryû,Chieko Higashiyama,Sô Yamamura,Setsuko Hara,Haruko Sugimura,Kuniko Miyake,Kyôko Kagawa,Eijirô Tôno,Nobuo Nakamura,Shirô Ôsaka,Hisao Toake,Teruko Nagaoka,Mutsuko Sakura,Toyo Takahashi,Tôru Abe,Sachiko Mitani,Zen Murase,Mitsuhiro Môri",Japan,"Japanese,English"
Vice-versa,Original title: Inside Out,2015,Tous publics,"1,h, ,35,m",8.1,"Animation,Adventure,Comedy","After young Riley is uprooted from her Midwest life and moved to San Francisco, her emotions - Joy, Fear, Anger, Disgust and Sadness - conflict on how best to navigate a new city, house, and school.","Amy Poehler,Bill Hader,Lewis Black,Mindy Kaling,Phyllis Smith,Richard Kind,Kaitlyn Dias,Diane Lane,Kyle MacLachlan,Paula Poundstone,Bobby Moynihan,Paula Pell,Dave Goelz,Frank Oz,Josh Cooley,Flea,John Ratzenberger,Carlos Alazraqui",United States,"English,Portuguese"
Blade Runner,,1982,Tous publics avec avertissement,"1,h, ,57,m",8.1,"Drama,Mystery,Sci-Fi","A blade runner must pursue and terminate four replicants who stole a ship in space, and have returned to Earth to find their creator.","Harrison Ford,Rutger Hauer,Sean Young,Edward James Olmos,M. Emmet Walsh,Daryl Hannah,William Sanderson,Brion James,Joe Turkel,Joanna Cassidy,James Hong,Morgan Paull,Kevin Thompson,John Edward Allen,Hy Pyke,Kimiko Hiroshige,Bob Okazaki,Carolyn DeMirjian",United States,"English,German,Cantonese,Japanese,Hungarian,Arabic,Korean"
Memories of Murder,Original title: Salinui chueok,2003,Tous publics,"2,h, ,11,m",8.1,"Crime,Drama,Mystery","In a small Korean province in 1986, two detectives struggle with the case of multiple young women being found raped and murdered by an unknown culprit.","Kang-ho Song,Kim Sang-kyung,Roe-ha Kim,Jae-ho Song,Byun Hee-Bong,Seo-hie Ko,Tae-ho Ryu,No-shik Park,Park Hae-il,Mi-seon Jeon,Young-hwa Seo,Woo Go-na,Ok-joo Lee,Jong-ryol Choi,Seung-mok Yoo,Hun-Kyung Lee,Hyeon-jong Sin,Jae-eung Lee",South Korea,"Korean,English"
V pour vendetta,Original title: V for Vendetta,2005,Tous publics avec avertissement,"2,h, ,12,m",8.1,"Action,Drama,Sci-Fi","In a future British tyranny, a shadowy freedom fighter, known only by the alias of ""V,"" plots to overthrow it with the help of a young woman.","Hugo Weaving,Natalie Portman,Rupert Graves,Stephen Rea,Stephen Fry,John Hurt,Tim Pigott-Smith,Roger Allam,Ben Miles,Sinéad Cusack,Natasha Wightman,John Standing,Eddie Marsan,Clive Ashborn,Emma Field-Rayner,Ian Burfield,Mark Phoenix,Alister Mazzotti",United States,English
