Titre,Titre_original,Annee,Public,Duree,Note,Type,Description,Actors,Country,Langue
Jurassic Park,,1993,Tous publics,"2,h, ,7,m",8.1,"Action,Adventure,Sci-Fi",A pragmatic paleontologist touring an almost complete theme park on an island in Central America is tasked with protecting a couple of kids after a power failure causes the park's cloned dinosaurs to run loose.,"Sam Neill,Laura Dern,Jeff Goldblum,Richard Attenborough,Bob Peck,Martin Ferrero,BD Wong,Joseph Mazzello,Ariana Richards,Samuel L. Jackson,Wayne Knight,Gerald R. Molen,Miguel Sandoval,Cameron Thor,Christopher John Fields,Whit Hertford,Dean Cundey,Jophery C. Brown",United States,"English,Spanish"
The Truman Show,,1998,Tous publics,"1,h, ,43,m",8.1,"Comedy,Drama",An insurance salesman discovers his whole life is actually a reality TV show.,"Jim Carrey,Ed Harris,Laura Linney,Noah Emmerich,Natascha McElhone,Holland Taylor,Brian Delate,Blair Slater,Peter Krause,Heidi Schanz,Ron Taylor,Don Taylor,Ted Raymond,Judy Clayton,Fritz Dominique,Angel Schmiedt,Nastassja Schmiedt,Muriel Moore",United States,English
Le troisième homme,Original title: The Third Man,1949,Tous publics,"1,h, ,44,m",8.1,"Film-Noir,Mystery,Thriller","Pulp novelist Holly Martins travels to shadowy, postwar Vienna, only to find himself investigating the mysterious death of an old friend, Harry Lime.","Orson Welles,Joseph Cotten,Alida Valli,Trevor Howard,Paul Hörbiger,Ernst Deutsch,Erich Ponto,Siegfried Breuer,Hedwig Bleibtreu,Bernard Lee,Wilfrid Hyde-White,Nelly Arno,Jack Arrow,Harold Ayer,Harry Belcher,Leo Bieber,Paul Birch,Martin Boddey",United Kingdom,"English,German,Russian,French"
Les fraises sauvages,Original title: Smultronstället,1957,Tous publics,"1,h, ,31,m",8.2,"Drama,Romance","After living a life marked by coldness, an aging professor is forced to confront the emptiness of his existence.","Victor Sjöström,Bibi Andersson,Ingrid Thulin,Gunnar Björnstrand,Jullan Kindahl,Folke Sundquist,Björn Bjelfvenstam,Naima Wifstrand,Gunnel Broström,Gertrud Fridh,Sif Ruud,Gunnar Sjöberg,Max von Sydow,Åke Fridell,Yngve Nordwall,Per Sjöstrand,Gio Petré,Gunnel Lindblom",Sweden,"Swedish,Latin"
La légende de Klaus,Original title: Klaus,2019,7,"1,h, ,36,m",8.2,"Animation,Adventure,Comedy","A simple act of kindness always sparks another, even in a frozen, faraway place. When Smeerensburg's new postman, Jesper, befriends toymaker Klaus, their gifts melt an age-old feud and deliver a sleigh full of holiday traditions.","Jason Schwartzman,J.K. Simmons,Rashida Jones,Will Sasso,Neda Margrethe Labba,Sergio Pablos,Norm MacDonald,Joan Cusack,Evan Agos,Sky Alexis,Jaeden Bettencourt,Teddy Blum,Mila Brener,Sydney Brower,Finn Carr,Kendall Joy Hall,Hailey Hermida,Lexie Holland",Spain,"English,Saami"
Sixième sens,Original title: The Sixth Sense,1999,12,"1,h, ,47,m",8.1,"Drama,Mystery,Thriller","A frightened, withdrawn Philadelphia boy who communicates with spirits seeks the help of a disheartened child psychologist.","Bruce Willis,Haley Joel Osment,Toni Collette,Olivia Williams,Trevor Morgan,Donnie Wahlberg,Peter Anthony Tambakis,Jeffrey Zubernis,Bruce Norris,Glenn Fitzgerald,Greg Wood,Mischa Barton,Angelica Page,Lisa Summerour,Firdous Bamji,Samia Shoaib,Hayden Saunier,Janis Dardaris",United States,"English,Latin,Spanish"
Elephant Man,Original title: The Elephant Man,1980,Tous publics,"2,h, ,4,m",8.1,"Biography,Drama","A Victorian surgeon rescues a heavily disfigured man who is mistreated while scraping a living as a side-show freak. Behind his monstrous façade, there is revealed a person of kindness, intelligence and sophistication.","Anthony Hopkins,John Hurt,Anne Bancroft,John Gielgud,Wendy Hiller,Freddie Jones,Michael Elphick,Hannah Gordon,Helen Ryan,John Standing,Dexter Fletcher,Lesley Dunlop,Phoebe Nicholls,Pat Gorman,Claire Davenport,Orla Pederson,Patsy Smart,Frederick Treves",United States,"English,French"
Le septième sceau,Original title: Det sjunde inseglet,1957,Tous publics,"1,h, ,36,m",8.2,"Drama,Fantasy,History","A knight returning to Sweden after the Crusades seeks answers about life, death, and the existence of God as he plays chess against the Grim Reaper during the Black Plague.","Max von Sydow,Gunnar Björnstrand,Bengt Ekerot,Nils Poppe,Bibi Andersson,Inga Gill,Maud Hansson,Inga Landgré,Gunnel Lindblom,Bertil Anderberg,Anders Ek,Åke Fridell,Gunnar Olsson,Erik Strandmark,Siv Aleros,Sten Ardenstam,Harry Asklund,Benkt-Åke Benktsson",Sweden,"Swedish,Latin"
No Country for Old Men,,2007,12,"2,h, ,2,m",8.1,"Crime,Drama,Thriller",Violence and mayhem ensue after a hunter stumbles upon a drug deal gone wrong and more than two million dollars in cash near the Rio Grande.,"Tommy Lee Jones,Javier Bardem,Josh Brolin,Woody Harrelson,Kelly Macdonald,Garret Dillahunt,Tess Harper,Barry Corbin,Stephen Root,Rodger Boyce,Beth Grant,Ana Reeder,Kit Gwin,Zach Hopkins,Chip Love,Eduardo Antonio Garcia,Gene Jones,Myk Watford",United States,"English,Spanish"
Le crime était presque parfait,Original title: Dial M for Murder,1954,Tous publics,"1,h, ,45,m",8.2,"Crime,Thriller",A former tennis player tries to arrange his wife's murder after learning of her affair.,"Ray Milland,Grace Kelly,Robert Cummings,John Williams,Anthony Dawson,Leo Britt,Patrick Allen,George Leigh,George Alderson,Robin Hughes,Richard Bender,Robin Sanders Clark,Jack Cunningham,Robert Dobson,Guy Doleman,Bess Flowers,Robert Garvin,Herschel Graham",United States,English
La ruée vers l'or,Original title: The Gold Rush,1925,Tous publics,"1,h, ,35,m",8.2,"Adventure,Comedy,Drama","A prospector goes to the Klondike during the 1890s gold rush in hopes of making his fortune, and is smitten with a girl he sees in a dance hall.","Charles Chaplin,Mack Swain,Tom Murray,Henry Bergman,Malcolm Waite,Georgia Hale,Jack Adams,Frank Aderias,Leona Aderias,Lillian Adrian,Sam Allen,Claude Anderson,Harry Arras,Albert Austin,Marta Belfort,William Bell,Francis Bernhardt,F.J. Beuaregard",United States,English
Shutter Island,,2010,12,"2,h, ,18,m",8.2,"Mystery,Thriller","In 1954, a U.S. Marshal investigates the disappearance of a murderer who escaped from a hospital for the criminally insane.","Leonardo DiCaprio,Emily Mortimer,Mark Ruffalo,Ben Kingsley,Max von Sydow,Michelle Williams,Patricia Clarkson,Jackie Earle Haley,Ted Levine,John Carroll Lynch,Elias Koteas,Robin Bartlett,Christopher Denham,Nellie Sciutto,Joseph Sikora,Curtiss Cook,Raymond Anthony Thomas,Joseph McKenna",United States,"English,German"
Dune,Original title: Dune: Part One,2021,Tous publics,"2,h, ,35,m",8.2,"Action,Adventure,Drama","Feature adaptation of Frank Herbert's science fiction novel, about the son of a noble family entrusted with the protection of the most valuable asset and most vital element in the galaxy.","Timothée Chalamet,Rebecca Ferguson,Zendaya,Oscar Isaac,Jason Momoa,Stellan Skarsgård,Stephen McKinley Henderson,Josh Brolin,Javier Bardem,Sharon Duncan-Brewster,Chang Chen,Dave Bautista,David Dastmalchian,Charlotte Rampling,Babs Olusanmokun,Benjamin Clémentine,Souad Faress,Golda Rosheuvel",United States,"English,Mandarin"
The Thing,,1982,13,"1,h, ,49,m",8.1,"Horror,Mystery,Sci-Fi",A research team in Antarctica is hunted by a shape-shifting alien that assumes the appearance of its victims.,"Kurt Russell,Wilford Brimley,Keith David,Richard Masur,T.K. Carter,David Clennon,Richard Dysart,Charles Hallahan,Peter Maloney,Donald Moffat,Joel Polis,Thomas G. Waites,Norbert Weisser,Larry Franco,Nate Irwin,William Zeman,Adrienne Barbeau,John Carpenter",United States,"English,Norwegian"
"Arnaques, crimes et botanique","Original title: Lock, Stock and Two Smoking Barrels",1998,Tous publics,"1,h, ,47,m",8.2,"Action,Comedy,Crime","Eddy persuades his three pals to pool money for a vital poker game against a powerful local mobster, Hatchet Harry. Eddy loses, after which Harry gives him a week to pay back 500,000 pounds.","Jason Flemyng,Dexter Fletcher,Nick Moran,Jason Statham,Steven Mackintosh,Nicholas Rowe,Nick Marcq,Charles Forbes,Vinnie Jones,Lenny McLean,Peter McNicholl,P.H. Moriarty,Frank Harper,Steve Sweeney,Huggy Leaver,Ronnie Fox,Tony McMahon,Stephen Marcus",United Kingdom,English
Mon voisin Totoro,Original title: Tonari no Totoro,1988,Tous publics,"1,h, ,26,m",8.2,"Animation,Comedy,Family","When two girls move to the country to be near their ailing mother, they have adventures with the wondrous forest spirits who live nearby.","Hitoshi Takagi,Noriko Hidaka,Chika Sakamoto,Shigesato Itoi,Sumi Shimamoto,Tanie Kitabayashi,Yûko Maruyama,Machiko Washio,Reiko Suzuki,Masashi Hirose,Toshiyuki Amagasa,Shigeru Chiba,Naoki Tatsuta,Tarako,Tomohiro Nishimura,Mitsuko Ishida,Chie Kôjiro,Daiki Nakamura",Japan,Japanese
Chinatown,,1974,12,"2,h, ,10,m",8.2,"Drama,Mystery,Thriller","A private detective hired to expose an adulterer in 1930s Los Angeles finds himself caught up in a web of deceit, corruption, and murder.","Jack Nicholson,Faye Dunaway,John Huston,Perry Lopez,John Hillerman,Darrell Zwerling,Diane Ladd,Roy Jenson,Roman Polanski,Richard Bakalyan,Joe Mantell,Bruce Glover,Nandu Hinds,James O'Rear,James Hong,Beulah Quo,Jerry Fujikawa,Belinda Palmer",United States,"English,Cantonese,Spanish"
3 Billboards: Les panneaux de la vengeance,"Original title: Three Billboards Outside Ebbing, Missouri",2017,Tous publics,"1,h, ,55,m",8.1,"Comedy,Crime,Drama",A mother personally challenges the local authorities to solve her daughter's murder when they fail to catch the culprit.,"Frances McDormand,Woody Harrelson,Sam Rockwell,Caleb Landry Jones,Kerry Condon,Alejandro Barrios,Jason Ledford,Darrell Britt-Gibson,Abbie Cornish,Riya May Atwood,Selah Atwood,Lucas Hedges,Zeljko Ivanek,Amanda Warren,Malaya Rivera Drew,Sandy Martin,Peter Dinklage,Christopher Berry",United Kingdom,English
Dersou Ouzala,Original title: Dersu Uzala,1975,Tous Public,"2,h, ,22,m",8.3,"Adventure,Biography,Drama",The Russian army sends an explorer on an expedition to the snowy Siberian wilderness where he makes friends with a seasoned local hunter.,"Maksim Munzuk,Yuriy Solomin,Mikhail Bychkov,Vladimir Khrulyov,V. Lastochkin,Stanislav Marin,Igor Sykhra,Vladimir Sergiyakov,Yanis Yakobsons,Vladimir Khlestov,G. Polunin,V. Koldin,M. Tetov,S. Sinyavskiy,Vladimir Sverba,V. Ignatov,Vladimir Kremena,Aleksandr Pyatkov",Soviet Union,"Russian,Chinese"
Raging Bull,,1980,Tous publics,"2,h, ,9,m",8.2,"Biography,Drama,Sport","The life of boxer Jake LaMotta, whose violence and temper that led him to the top in the ring destroyed his life outside of it.","Robert De Niro,Cathy Moriarty,Joe Pesci,Frank Vincent,Nicholas Colasanto,Theresa Saldana,Mario Gallo,Frank Adonis,Joseph Bono,Frank Topham,Lori Anne Flax,Charles Scorsese,Don Dunphy,Bill Hanrahan,Rita Bennett,James V. Christy,Bernie Allen,Floyd Anderson",United States,English
Dans ses yeux,Original title: El secreto de sus ojos,2009,Tous publics,"2,h, ,9,m",8.2,"Drama,Mystery,Romance",A retired legal counselor writes a novel hoping to find closure for one of his past unresolved homicide cases and for his unreciprocated love with his superior - both of which still haunt him decades later.,"Ricardo Darín,Soledad Villamil,Pablo Rago,Carla Quevedo,Javier Godino,Bárbara Palladino,Rudy Romano,Alejandro Abelenda,Mario Alarcón,Guillermo Francella,Sebastián Blanco,Mariano Argento,José Luis Gioia,Juan José Ortíz,Kiko Cerone,Fernando Pardo,Maximiliano Trento,Sergio López Santana",Argentina,Spanish
Un homme d'exception,Original title: A Beautiful Mind,2001,Tous publics,"2,h, ,15,m",8.2,"Biography,Drama","After John Nash, a brilliant but asocial mathematician, accepts secret work in cryptography, his life takes a turn for the nightmarish.","Russell Crowe,Ed Harris,Jennifer Connelly,Christopher Plummer,Paul Bettany,Adam Goldberg,Josh Lucas,Anthony Rapp,Jason Gray-Stanford,Judd Hirsch,Austin Pendleton,Vivien Cardone,Jillie Simon,Victor Steinbach,Tanya Clarke,Thomas F. Walsh,Jesse Doran,Kent Cassella",United States,English
Le labyrinthe de Pan,Original title: El laberinto del fauno,2006,12,"1,h, ,58,m",8.2,"Drama,Fantasy,War","In the Falangist Spain of 1944, the bookish young stepdaughter of a sadistic army officer escapes into an eerie but captivating fantasy world.","Ivana Baquero,Ariadna Gil,Sergi López,Maribel Verdú,Doug Jones,Álex Angulo,Manolo Solo,César Vea,Roger Casamajor,Ivan Massagué,Gonzalo Uriarte,Eusebio Lázaro,Francisco Vidal,Juanjo Cucalón,Lina Mira,Mario Zorrilla,Sebastián Haro,Mila Espiga",Mexico,Spanish
Le Trésor de la Sierra Madre,Original title: The Treasure of the Sierra Madre,1948,Tous publics,"2,h, ,6,m",8.2,"Adventure,Drama,Western",Two down-on-their-luck Americans searching for work in 1920s Mexico convince an old prospector to help them mine for gold in the Sierra Madre Mountains.,"Humphrey Bogart,Walter Huston,Tim Holt,Bruce Bennett,Barton MacLane,Alfonso Bedoya,Arturo Soto Rangel,Manuel Dondé,José Torvay,Margarito Luna,Robert Blake,Guillermo Calles,Roberto Cañedo,Spencer Chan,Jacqueline Dalya,Ralph Dunn,Ernesto Escoto,Pat Flaherty",United States,"English,Spanish"
There Will Be Blood,,2007,Tous publics avec avertissement,"2,h, ,38,m",8.2,Drama,"A story of family, religion, hatred, oil and madness, focusing on a turn-of-the-century prospector in the early days of the business.","Daniel Day-Lewis,Paul Dano,Ciarán Hinds,Martin Stringer,Matthew Braden Stringer,Jacob Stringer,Joseph Mussey,Barry Del Sherman,Harrison Taylor,Stockton Taylor,Paul F. Tompkins,Dillon Freasier,Kevin Breznahan,Jim Meskimen,Erica Sullivan,Randall Carver,Coco Leigh,Sydney McCallister",United States,"English,American Sign Language"
Casino,,1995,12,"2,h, ,58,m",8.2,"Crime,Drama","A tale of greed, deception, money, power, and murder occur between two best friends: a mafia enforcer and a casino executive compete against each other over a gambling empire, and over a fast-living and fast-loving socialite.","Robert De Niro,Sharon Stone,Joe Pesci,James Woods,Don Rickles,Alan King,Kevin Pollak,L.Q. Jones,Dick Smothers,Frank Vincent,John Bloom,Pasquale Cajano,Melissa Prophet,Bill Allison,Vinny Vella,Philip Suriano,Erika von Tagen,Frankie Avalon",United States,English
La Grande Évasion,Original title: The Great Escape,1963,Tous publics,"2,h, ,52,m",8.2,"Adventure,Drama,History",Allied prisoners of war plan for several hundred of their number to escape from a German camp during World War II.,"Steve McQueen,James Garner,Richard Attenborough,Charles Bronson,James Donald,Donald Pleasence,James Coburn,Hannes Messemer,David McCallum,Gordon Jackson,John Leyton,Angus Lennie,Nigel Stock,Robert Graf,Jud Taylor,Hans Reiser,Harry Riebauer,William Russell",United States,"English,German,French,Russian,Spanish"
Jugement à Nuremberg,Original title: Judgment at Nuremberg,1961,Tous publics,"2,h, ,59,m",8.2,"Drama,War","In 1948, an American court in occupied Germany tries four Nazis judged for war crimes.","Spencer Tracy,Burt Lancaster,Richard Widmark,Marlene Dietrich,Maximilian Schell,Judy Garland,Montgomery Clift,William Shatner,Werner Klemperer,Kenneth MacKenna,Torben Meyer,Joseph Bernard,Alan Baxter,Edward Binns,Virginia Christine,Otto Waldis,Karl Swenson,Martin Brandt",United States,"English,German"
Le loup de Wall Street,Original title: The Wolf of Wall Street,2013,12,"3,h",8.2,"Biography,Comedy,Crime","Based on the true story of Jordan Belfort, from his rise to a wealthy stock-broker living the high life to his fall involving crime, corruption and the federal government.","Leonardo DiCaprio,Jonah Hill,Margot Robbie,Matthew McConaughey,Kyle Chandler,Rob Reiner,Jon Bernthal,Jon Favreau,Jean Dujardin,Joanna Lumley,Cristin Milioti,Christine Ebersole,Shea Whigham,Katarina Cas,P.J. Byrne,Kenneth Choi,Brian Sacca,Henry Zebrowski",United States,"English,French"
Le château ambulant,Original title: Hauru no ugoku shiro,2004,Tous publics,"1,h, ,59,m",8.2,"Animation,Adventure,Family","When an unconfident young woman is cursed with an old body by a spiteful witch, her only chance of breaking the spell lies with a self-indulgent yet insecure young wizard and his companions in his legged, walking castle.","Chieko Baishô,Takuya Kimura,Tatsuya Gashûin,Akihiro Miwa,Ryûnosuke Kamiki,Mitsunori Isaki,Yô Ôizumi,Akio Ôtsuka,Daijirô Harada,Haruko Katô,Jean Simmons,Christian Bale,Lauren Bacall,Blythe Danner,Emily Mortimer,Josh Hutcherson,Billy Crystal,Jena Malone",Japan,Japanese
Les enfants du ciel,Original title: Bacheha-Ye aseman,1997,Tous publics,"1,h, ,29,m",8.3,"Drama,Family,Sport","After a boy loses his sister's pair of shoes, he goes on a series of adventures in order to find them. When he can't, he tries a new way to ""win"" a new pair.","Mohammad Amir Naji,Amir Farrokh Hashemian,Bahare Seddiqi,Nafise Jafar-Mohammadi,Fereshte Sarabandi,Kamal Mirkarimi,Behzad Rafi,Dariush Mokhtari,Mohammad-Hasan Hosseinian,Masume Dair,Kambiz Peykarnegar,Hasan Roohparvari,Abbas-Ali Roomandi,Jafar Seyfollahi,Qolamreza Maleki,Zahra Mirzai,Sara Zamani,Mohammad Haj-Hosseini",Iran,Persian
Impitoyable,Original title: Unforgiven,1992,Tous publics,"2,h, ,10,m",8.2,"Drama,Western","Retired Old West gunslinger William Munny reluctantly takes on one last job, with the help of his old partner Ned Logan and a young man, The ""Schofield Kid.""","Clint Eastwood,Gene Hackman,Morgan Freeman,Richard Harris,Jaimz Woolvett,Saul Rubinek,Frances Fisher,Anna Thomson,David Mucci,Rob Campbell,Anthony James,Tara Frederick,Beverley Elliott,Liisa Repo-Martell,Josie Smith,Shane Meier,Aline Levasseur,Cherrilene Cardinal",United States,English
Batman Begins,,2005,Tous publics,"2,h, ,20,m",8.2,"Action,Adventure","After training with his mentor, Batman begins his fight to free crime-ridden Gotham City from corruption.","Christian Bale,Michael Caine,Ken Watanabe,Liam Neeson,Katie Holmes,Gary Oldman,Cillian Murphy,Tom Wilkinson,Rutger Hauer,Mark Boone Junior,Linus Roache,Morgan Freeman,Larry Holden,Gerard Murphy,Colin McFarlane,Sara Stewart,Gus Lewis,Richard Brake",United Kingdom,"English,Mandarin"
Certains l'aiment chaud,Original title: Some Like It Hot,1959,12,"2,h, ,1,m",8.2,"Comedy,Music,Romance","After two male musicians witness a mob hit, they flee the state in an all-female band disguised as women, but further complications set in.","Marilyn Monroe,Tony Curtis,Jack Lemmon,George Raft,Pat O'Brien,Joe E. Brown,Nehemiah Persoff,Joan Shawlee,Billy Gray,George E. Stone,Dave Barry,Mike Mazurki,Harry Wilson,Beverly Wills,Barbara Drew,Edward G. Robinson Jr.,Sam Bagley,Brandon Beach",United States,English
Ève...,Original title: All About Eve,1950,Tous publics,"2,h, ,18,m",8.2,Drama,A seemingly timid but secretly ruthless ingénue insinuates herself into the lives of an aging Broadway star and her circle of theater friends.,"Bette Davis,Anne Baxter,George Sanders,Celeste Holm,Gary Merrill,Hugh Marlowe,Gregory Ratoff,Barbara Bates,Marilyn Monroe,Thelma Ritter,Walter Hampden,Randy Stuart,Craig Hill,Leland Harris,Barbara White,Eddie Fisher,William Pullen,Claude Stroud",United States,"English,French"
Monty Python : Sacré Graal !,Original title: Monty Python and the Holy Grail,1975,Tous publics,"1,h, ,31,m",8.2,"Adventure,Comedy,Fantasy","King Arthur and his Knights of the Round Table embark on a surreal, low-budget search for the Holy Grail, encountering many, very silly obstacles.","Graham Chapman,John Cleese,Eric Idle,Terry Gilliam,Terry Jones,Michael Palin,Connie Booth,Carol Cleveland,Neil Innes,Bee Duffell,John Young,Rita Davies,Avril Stewart,Sally Kinghorn,Mark Zycon,Elspeth Cameron,Mitsuko Forstater,Sandy Johnson",United Kingdom,"English,French,Latin"
La chute,Original title: Der Untergang,2004,Tous publics avec avertissement,"2,h, ,36,m",8.2,"Biography,Drama,History","Traudl Junge, the final secretary for Adolf Hitler, tells of the Nazi dictator's final days in his Berlin bunker at the end of WWII.","Bruno Ganz,Alexandra Maria Lara,Ulrich Matthes,Juliane Köhler,Corinna Harfouch,Heino Ferch,Christian Berkel,Matthias Habich,Thomas Kretschmann,Michael Mendl,André Hennicke,Ulrich Noethen,Birgit Minichmayr,Rolf Kanies,Justus von Dohnányi,Dieter Mann,Christian Redl,Götz Otto",Germany,"German,Russian,French,English"
Rashomon,Original title: Rashômon,1950,Tous Public,"1,h, ,28,m",8.2,"Crime,Drama,Mystery","The rape of a bride and the murder of her samurai husband are recalled from the perspectives of a bandit, the bride, the samurai's ghost and a woodcutter.","Toshirô Mifune,Machiko Kyô,Masayuki Mori,Takashi Shimura,Minoru Chiaki,Kichijirô Ueda,Noriko Honma,Daisuke Katô",Japan,Japanese
Piège de cristal,Original title: Die Hard,1988,Tous publics,"2,h, ,12,m",8.2,"Action,Thriller",An NYPD officer tries to save his wife and several others taken hostage by German terrorists during a Christmas party at the Nakatomi Plaza in Los Angeles.,"Bruce Willis,Alan Rickman,Bonnie Bedelia,Reginald VelJohnson,Paul Gleason,De'voreaux White,William Atherton,Hart Bochner,James Shigeta,Alexander Godunov,Bruno Doyon,Andreas Wisniewski,Clarence Gilyard Jr.,Joey Plewa,Lorenzo Caccialanza,Gérard Bonn,Dennis Hayden,Al Leong",United States,"English,German,Italian,Japanese"
Green Book: Sur les routes du Sud,Original title: Green Book,2018,Tous publics,"2,h, ,10,m",8.2,"Biography,Comedy,Drama",A working-class Italian-American bouncer becomes the driver of an African-American classical pianist on a tour of venues through the 1960s American South.,"Viggo Mortensen,Mahershala Ali,Linda Cardellini,Sebastian Maniscalco,Dimiter D. Marinov,Mike Hatton,P.J. Byrne,Joe Cortese,Maggie Nixon,Von Lewis,Jon Sortland,Don Stark,Anthony Mangano,Paul Sloan,Quinn Duffy,Seth Hurwitz,Hudson Galloway,Gavin Lyle Foley",United States,"English,Italian,Russian,German"
Le garde du corps,Original title: Yôjinbô,1961,Tous publics,"1,h, ,50,m",8.2,"Action,Drama,Thriller",A crafty ronin comes to a town divided by two criminal gangs and decides to play them against each other to free the town.,"Toshirô Mifune,Eijirô Tôno,Tatsuya Nakadai,Yôko Tsukasa,Isuzu Yamada,Daisuke Katô,Seizaburô Kawazu,Takashi Shimura,Hiroshi Tachikawa,Yôsuke Natsuki,Kamatari Fujiwara,Ikio Sawamura,Atsushi Watanabe,Susumu Fujita,Kyû Sazanka,Kô Nishimura,Takeshi Katô,Ichirô Nakatani",Japan,Japanese
L.A. Confidential,,1997,Tous publics,"2,h, ,18,m",8.2,"Crime,Drama,Mystery","As corruption grows in 1950s Los Angeles, three policemen - one strait-laced, one brutal, and one sleazy - investigate a series of murders with their own brand of justice.","Kevin Spacey,Russell Crowe,Guy Pearce,Kim Basinger,James Cromwell,Danny DeVito,David Strathairn,Ron Rifkin,Matt McCoy,Paul Guilfoyle,Paolo Seganti,Elisabeth Granli,Sandra Taylor,Steve Rankin,Graham Beckel,Allan Graf,Precious Chong,Symba",United States,English
Ran,,1985,Tous publics,"2,h, ,42,m",8.2,"Action,Drama,War","In Medieval Japan, an elderly warlord retires, handing over his empire to his three sons. However, he vastly underestimates how the new-found power will corrupt them and cause them to turn on each other...and him.","Tatsuya Nakadai,Akira Terao,Jinpachi Nezu,Daisuke Ryû,Mieko Harada,Yoshiko Miyazaki,Hisashi Igawa,Pîtâ,Masayuki Yui,Kazuo Katô,Norio Matsui,Toshiya Ito,Kenji Kodama,Takashi Watanabe,Mansai Nomura,Takeshi Katô,Jun Tazaki,Hitoshi Ueki",Japan,Japanese
Heat,,1995,Tous publics avec avertissement,"2,h, ,50,m",8.2,"Action,Crime,Drama",A group of high-end professional thieves start to feel the heat from the LAPD when they unknowingly leave a clue at their latest heist.,"Al Pacino,Robert De Niro,Val Kilmer,Jon Voight,Tom Sizemore,Diane Venora,Amy Brenneman,Ashley Judd,Mykelti Williamson,Wes Studi,Ted Levine,Dennis Haysbert,William Fichtner,Natalie Portman,Tom Noonan,Kevin Gage,Hank Azaria,Susan Traylor",United States,"English,Spanish"
Indiana Jones et la dernière croisade,Original title: Indiana Jones and the Last Crusade,1989,Tous publics,"2,h, ,7,m",8.2,"Action,Adventure","In 1938, after his father Professor Henry Jones, Sr. goes missing while pursuing the Holy Grail, Professor Henry ""Indiana"" Jones, Jr. finds himself up against Adolf Hitler's Nazis again to stop them from obtaining its powers.","Harrison Ford,Sean Connery,Alison Doody,Denholm Elliott,John Rhys-Davies,Julian Glover,River Phoenix,Michael Byrne,Kevork Malikyan,Robert Eddison,Richard Young,Alexei Sayle,Alex Hyde-White,Paul Maxwell,Isla Blair,Vernon Dobtcheff,J.J. Hardy,Bradley Gregg",United States,"English,German,Greek,Arabic"
...et pour quelques dollars de plus,Original title: Per qualche dollaro in più,1965,18,"2,h, ,12,m",8.2,Western,Two bounty hunters with the same intentions team up to track down a Western outlaw.,"Clint Eastwood,Lee Van Cleef,Gian Maria Volontè,Mara Krupp,Luigi Pistilli,Klaus Kinski,Luis Rodríguez,Benito Stefanelli,Panos Papadopulos,Aldo Sambrell,Roberto Camardiel,Joseph Egger,Tomás Blanco,Lorenzo Robledo,Dante Maggio,Sergio Mendizábal,Diana Rabito,Giovanni Tarallo",Italy,"Italian,English"
Toy Story 3,,2010,Tous publics,"1,h, ,43,m",8.2,"Animation,Adventure,Comedy","The toys are mistakenly delivered to a day-care center instead of the attic right before Andy leaves for college, and it's up to Woody to convince the other toys that they weren't abandoned and to return home.","Tom Hanks,Tim Allen,Joan Cusack,Ned Beatty,Don Rickles,Michael Keaton,Wallace Shawn,John Ratzenberger,Estelle Harris,John Morris,Jodi Benson,Emily Ricks Hahn,Laurie Metcalf,Blake Clark,Teddy Newton,Bud Luckey,Bea Miller,Javier Fernández-Peña",United States,"English,Spanish"
Du silence et des ombres...,Original title: To Kill a Mockingbird,1962,12,"2,h, ,9,m",8.3,"Crime,Drama","Atticus Finch, a widowed lawyer in Depression-era Alabama, defends a black man against an undeserved rape charge, and his children against prejudice.","Gregory Peck,John Megna,Frank Overton,Rosemary Murphy,Ruth White,Brock Peters,Estelle Evans,Paul Fix,Collin Wilcox Paxton,James Anderson,Alice Ghostley,Robert Duvall,William Windom,Crahan Denton,Richard Hale,Mary Badham,Phillip Alford,R.L. Armstrong",United States,English
