Titre,Titre_original,Annee,Public,Duree,Note,Type,Description,Actors,Country,Langue
Aliens : Le Retour,Original title: Aliens,1986,13,"2,h, ,17,m",8.3,"Action,Adventure,Sci-Fi","Fifty-seven years after surviving an apocalyptic attack aboard her space vessel by merciless space creatures, Officer Ripley awakens from hyper-sleep and tries to warn anyone who will listen about the predators.","Sigourney Weaver,Michael Biehn,Carrie Henn,Paul Reiser,Lance Henriksen,Bill Paxton,William Hope,Jenette Goldstein,Al Matthews,Mark Rolston,Ricco Ross,Colette Hiller,Daniel Kash,Cynthia Dale Scott,Tip Tipping,Trevor Steedman,Paul Maxwell,Valerie Colgan",United Kingdom,English
Coco,,2017,Tous publics,"1,h, ,45,m",8.4,"Animation,Adventure,Comedy","Aspiring musician Miguel, confronted with his family's ancestral ban on music, enters the Land of the Dead to find his great-great-grandfather, a legendary singer.","Anthony Gonzalez,Gael García Bernal,Benjamin Bratt,Alanna Ubach,Renee Victor,Jaime Camil,Alfonso Arau,Herbert Siguenza,Gabriel Iglesias,Lombardo Boyar,Ana Ofelia Murguía,Natalia Cordova-Buckley,Selene Luna,Edward James Olmos,Sofía Espinosa,Carla Medina,Dyana Ortelli,Luis Valdez",United States,"English,Spanish"
Your Name.,Original title: Kimi no na wa.,2016,Tous publics,"1,h, ,46,m",8.4,"Animation,Drama,Fantasy","Two strangers find themselves linked in a bizarre way. When a connection forms, will distance be the only thing to keep them apart?","Ryûnosuke Kamiki,Mone Kamishiraishi,Ryô Narita,Aoi Yûki,Nobunaga Shimazaki,Kaito Ishikawa,Kanon Tani,Masaki Terasoma,Sayaka Ôhara,Kazuhiko Inoue,Chafûrin,Kana Hanazawa,Yuka Terasaki,Takashi Onozuka,Yôhei Namekawa,Miyu Tsuji,Shin'ya Hamazoe,Kanami Satô",Japan,Japanese
Old Boy,Original title: Oldeuboi,2003,16,"2,h",8.4,"Action,Drama,Mystery","After being kidnapped and imprisoned for fifteen years, Oh Dae-Su is released, only to find that he must find his captor in five days.","Choi Min-sik,Yoo Ji-Tae,Kang Hye-jeong,Kim Byeong-Ok,Dae-han Ji,Dal-su Oh,Seung-shin Lee,Jin-Seo Yoon,Tae-kyung Oh,Yoo Yeon-Seok,Il-han Oo,Young-hee Lee,Young-ae Kim,Mi Mi Lee,Jae-Duk Han,Jung Ae Kwak,San Kim,Chae-soo Jang",South Korea,Korean
The Dark Knight Rises,,2012,Tous publics,"2,h, ,44,m",8.4,"Action,Crime","Eight years after the Joker's reign of anarchy, Batman, with the help of the enigmatic Catwoman, is forced from his exile to save Gotham City from the brutal guerrilla terrorist Bane.","Christian Bale,Tom Hardy,Anne Hathaway,Gary Oldman,Joseph Gordon-Levitt,Marion Cotillard,Morgan Freeman,Michael Caine,Matthew Modine,Alon Aboutboul,Ben Mendelsohn,Burn Gorman,Daniel Sunjata,Aidan Gillen,Sam Kennard,Aliash Tepina,Nestor Carbonell,Brett Cullen",United Kingdom,"English,Arabic"
Joker,,2019,12 avec avertissement,"2,h, ,2,m",8.4,"Crime,Drama,Thriller","In Gotham City, mentally troubled comedian Arthur Fleck is disregarded and mistreated by society. He then embarks on a downward spiral of revolution and bloody crime. This path brings him face-to-face with his alter-ego: the Joker.","Joaquin Phoenix,Robert De Niro,Zazie Beetz,Frances Conroy,Brett Cullen,Shea Whigham,Bill Camp,Glenn Fleshler,Leigh Gill,Josh Pais,Rocco Luna,Marc Maron,Sondra James,Murphy Guyer,Douglas Hodge,Dante Pereira-Olson,Carrie Louise Putrello,Sharon Washington",United States,English
Princesse Mononoké,Original title: Mononoke-hime,1997,Tous publics,"2,h, ,14,m",8.4,"Animation,Action,Adventure","On a journey to find the cure for a Tatarigami's curse, Ashitaka finds himself in the middle of a war between the forest gods and Tatara, a mining colony. In this quest he also meets San, the Mononoke Hime.","Yôji Matsuda,Yuriko Ishida,Yûko Tanaka,Billy Crudup,Billy Bob Thornton,Minnie Driver,John DiMaggio,Claire Danes,John DeMita,Jada Pinkett Smith,Gillian Anderson,Keith David,Corey Burton,Tara Strong,Julia Fletcher,Debi Derryberry,Alex Fernandez,Jack Fletcher",Japan,Japanese
Dr. Folamour ou : Comment j'ai appris à ne plus m'en faire et à aimer la bombe !,Original title: Dr. Strangelove or: How I Learned to Stop Worrying and Love the Bomb,1964,Tous publics,"1,h, ,35,m",8.4,"Comedy,War","An insane American general orders a bombing attack on the Soviet Union, triggering a path to nuclear holocaust that a war room full of politicians and generals frantically tries to stop.","Peter Sellers,George C. Scott,Sterling Hayden,Keenan Wynn,Slim Pickens,Peter Bull,James Earl Jones,Tracy Reed,Jack Creley,Frank Berry,Robert O'Neil,Glenn Beck,Roy Stephens,Shane Rimmer,Hal Galili,Paul Tamarin,Laurence Herder,Gordon Tanner",United Kingdom,"English,Russian"
Spider-Man: New Generation,Original title: Spider-Man: Into the Spider-Verse,2018,Tous publics,"1,h, ,57,m",8.4,"Animation,Action,Adventure","Teen Miles Morales becomes the Spider-Man of his universe, and must join with five spider-powered individuals from other dimensions to stop a threat for all realities.","Shameik Moore,Jake Johnson,Hailee Steinfeld,Mahershala Ali,Brian Tyree Henry,Lily Tomlin,Luna Lauren Velez,Zoë Kravitz,John Mulaney,Kimiko Glenn,Nicolas Cage,Kathryn Hahn,Liev Schreiber,Chris Pine,Natalie Morales,Edwin R. Habacon,Oscar Isaac,Greta Lee",United States,"English,Spanish"
Shining,Original title: The Shining,1980,12,"2,h, ,26,m",8.4,"Drama,Horror","A family heads to an isolated hotel for the winter where a sinister presence influences the father into violence, while his psychic son sees horrific forebodings from both past and future.","Jack Nicholson,Shelley Duvall,Danny Lloyd,Scatman Crothers,Barry Nelson,Philip Stone,Joe Turkel,Anne Jackson,Tony Burton,Lia Beldam,Billie Gibson,Barry Dennen,David Baxt,Manning Redwood,Lisa Burns,Louise Burns,Robin Pappas,Alison Coleridge",United Kingdom,English
Témoin à charge,Original title: Witness for the Prosecution,1957,Tous publics,"1,h, ,56,m",8.4,"Crime,Drama,Mystery",A veteran British barrister must defend his client in a murder trial that has surprise after surprise.,"Tyrone Power,Marlene Dietrich,Charles Laughton,Elsa Lanchester,John Williams,Henry Daniell,Ian Wolfe,Torin Thatcher,Norma Varden,Una O'Connor,Francis Compton,Philip Tonge,Ruta Lee,Patrick Aherne,Don Ames,Walter Bacon,Eddie Baker,Benjie Bancroft",United States,"English,German"
Le Prestige,Original title: The Prestige,2006,Tous publics,"2,h, ,10,m",8.5,"Drama,Mystery,Sci-Fi","After a tragic accident, two stage magicians in 1890s London engage in a battle to create the ultimate illusion while sacrificing everything they have to outwit each other.","Christian Bale,Hugh Jackman,Scarlett Johansson,Michael Caine,Piper Perabo,Rebecca Hall,Samantha Mahurin,David Bowie,Andy Serkis,Daniel Davis,Jim Piddock,Christopher Neame,Mark Ryan,Roger Rees,Jamie Harris,Monty Stuart,Ron Perkins,Ricky Jay",United Kingdom,English
Intouchables,,2011,Tous publics,"1,h, ,52,m",8.5,"Biography,Comedy,Drama","After he becomes a quadriplegic from a paragliding accident, an aristocrat hires a young man from the projects to be his caregiver.","François Cluzet,Omar Sy,Anne Le Ny,Audrey Fleurot,Joséphine de Meaux,Clotilde Mollet,Alba Gaïa Bellugi,Cyril Mendy,Salimata Kamate,Absa Diatou Toure,Grégoire Oestermann,Dominique Daguier,François Caron,Christian Ameri,Thomas Solivérès,Dorothée Brière,Marie-Laure Descoureaux,Émilie Caen",France,"French,English"
Les infiltrés,Original title: The Departed,2006,Tous publics avec avertissement,"2,h, ,31,m",8.5,"Action,Crime,Drama",An undercover cop and a mole in the police attempt to identify each other while infiltrating an Irish gang in South Boston.,"Leonardo DiCaprio,Matt Damon,Jack Nicholson,Mark Wahlberg,Martin Sheen,Ray Winstone,Vera Farmiga,Anthony Anderson,Alec Baldwin,Kevin Corrigan,James Badge Dale,David O'Hara,Mark Rolston,Robert Wahlberg,Kristen Dalton,Thomas B. Duffy,Richard Hughes,J.C. MacKenzie",United States,"English,Cantonese"
Gladiator,,2000,Tous publics avec avertissement,"2,h, ,35,m",8.5,"Action,Adventure,Drama",A former Roman General sets out to exact vengeance against the corrupt emperor who murdered his family and sent him into slavery.,"Russell Crowe,Joaquin Phoenix,Connie Nielsen,Oliver Reed,Richard Harris,Derek Jacobi,Djimon Hounsou,David Schofield,John Shrapnel,Tomas Arana,Ralf Moeller,Spencer Treat Clark,David Hemmings,Tommy Flanagan,Sven-Ole Thorsen,Omid Djalili,Nicholas McGaughey,Chris Kell",United States,English
Whiplash,,2014,Tous publics,"1,h, ,46,m",8.5,"Drama,Music",A promising young drummer enrolls at a cut-throat music conservatory where his dreams of greatness are mentored by an instructor who will stop at nothing to realize a student's potential.,"Miles Teller,J.K. Simmons,Melissa Benoist,Paul Reiser,Austin Stowell,Nate Lang,Chris Mulkey,Damon Gupton,Suanne Spoke,Max Kasch,Charlie Ian,Jayson Blair,Kofi Siriboe,Kavita Patil,C.J. Vana,Tarik Lowe,Tyler Kimball,Rogelio Douglas Jr.",United States,English
Le tombeau des lucioles,Original title: Hotaru no haka,1988,Tous publics,"1,h, ,29,m",8.5,"Animation,Drama,War",A young boy and his little sister struggle to survive in Japan during World War II.,"Tsutomu Tatsumi,Ayano Shiraishi,Akemi Yamaguchi,Yoshiko Shinohara,Kôzô Hashida,Masayo Sakai,Kazumi Nozaki,Yoshio Matsuoka,Masahiro Kanetake,Kiyoshi Yanagawa,Hajime Maki,Atsuo Omote,Teruhisa Harita,Hiroshi Tanaka,Michio Denpô,Shirô Tamaki,Tadashi Nakamura,Mika Sekita",Japan,Japanese
American History X,,1998,12,"1,h, ,59,m",8.5,Drama,A former neo-nazi skinhead tries to prevent his younger brother from going down the same wrong path that he did.,"Edward Norton,Edward Furlong,Beverly D'Angelo,Jennifer Lien,Ethan Suplee,Fairuza Balk,Avery Brooks,Elliott Gould,Stacy Keach,William Russ,Guy Torry,Joe Cortese,Jason Bose Smith,Antonio David Lyons,Alex Sol,Keram Malicki-Sánchez,Giuseppe Andrews,Michelle Christine White",United States,English
Les lumières de la ville,Original title: City Lights,1931,Tous publics,"1,h, ,27,m",8.5,"Comedy,Drama,Romance","With the aid of a wealthy erratic tippler, a dewy-eyed tramp who has fallen in love with a sightless flower girl accumulates money to be able to help her medically.","Charles Chaplin,Virginia Cherrill,Florence Lee,Harry Myers,Al Ernest Garcia,Hank Mann,Johnny Aber,Jack Alexander,T.S. Alexander,Victor Alexander,Albert Austin,Harry Ayers,Eddie Baker,Henry Bergman,Edward Biby,Betty Blair,Buster Brodie,Jeanne Carpenter",United States,"None,English"
Les temps modernes,Original title: Modern Times,1936,Tous publics,"1,h, ,27,m",8.5,"Comedy,Drama,Family",The Tramp struggles to live in modern industrial society with the help of a young homeless woman.,"Charles Chaplin,Paulette Goddard,Henry Bergman,Tiny Sandford,Chester Conklin,Hank Mann,Stanley Blystone,Al Ernest Garcia,Richard Alexander,Cecil Reynolds,Mira McKinney,Murdock MacQuarrie,Wilfred Lucas,Edward LeSaint,Fred Malatesta,Sammy Stein,Juana Sutton,Ted Oliver",United States,English
Le Roi Lion,Original title: The Lion King,1994,Tous publics,"1,h, ,28,m",8.5,"Animation,Adventure,Drama","Lion prince Simba and his father are targeted by his bitter uncle, who wants to ascend the throne himself.","Matthew Broderick,Jeremy Irons,James Earl Jones,Whoopi Goldberg,Rowan Atkinson,Niketa Calame-Harris,Jim Cummings,Robert Guillaume,Moira Kelly,Nathan Lane,Zoe Leader,Cheech Marin,Ernie Sabella,Madge Sinclair,Jonathan Taylor Thomas,Frank Welker,Cathy Cavadini,Judi M. Durand",United States,"English,Swahili,Xhosa,Zulu"
Psychose,Original title: Psycho,1960,18,"1,h, ,49,m",8.5,"Horror,Mystery,Thriller","A Phoenix secretary embezzles $40,000 from her employer's client, goes on the run, and checks into a remote motel run by a young man under the domination of his mother.","Anthony Perkins,Janet Leigh,Vera Miles,John Gavin,Martin Balsam,John McIntire,Simon Oakland,Frank Albertson,Patricia Hitchcock,Vaughn Taylor,Lurene Tuttle,John Anderson,Mort Mills,Fletcher Allen,Walter Bacon,Prudence Beers,Kit Carson,Francis De Sales",United States,English
Retour vers le futur,Original title: Back to the Future,1985,Tous publics,"1,h, ,56,m",8.5,"Adventure,Comedy,Sci-Fi","Marty McFly, a 17-year-old high school student, is accidentally sent thirty years into the past in a time-traveling DeLorean invented by his close friend, the eccentric scientist Doc Brown.","Michael J. Fox,Christopher Lloyd,Lea Thompson,Crispin Glover,Thomas F. Wilson,Claudia Wells,Marc McClure,Wendie Jo Sperber,George DiCenzo,Frances Lee McCain,James Tolkan,J.J. Cohen,Casey Siemaszko,Billy Zane,Harry Waters Jr.,Donald Fullilove,Lisa Freeman,Cristen Kauffman",United States,English
Usual Suspects,Original title: The Usual Suspects,1995,Tous publics,"1,h, ,46,m",8.5,"Crime,Drama,Mystery","A sole survivor tells of the twisty events leading up to a horrific gun battle on a boat, which began when five criminals met at a seemingly random police lineup.","Kevin Spacey,Gabriel Byrne,Chazz Palminteri,Stephen Baldwin,Benicio Del Toro,Kevin Pollak,Pete Postlethwaite,Suzy Amis,Giancarlo Esposito,Dan Hedaya,Paul Bartel,Carl Bressler,Phillipe Simon,Jack Shearer,Christine Estabrook,Clark Gregg,Morgan Hunter,Ken Daly",United States,"English,Hungarian,Spanish,French"
Terminator 2 : Le jugement dernier,Original title: Terminator 2: Judgment Day,1991,12,"2,h, ,17,m",8.5,"Action,Sci-Fi","A cyborg, identical to the one who failed to kill Sarah Connor, must now protect her ten-year-old son John from a more advanced and powerful cyborg.","Arnold Schwarzenegger,Linda Hamilton,Edward Furlong,Robert Patrick,Earl Boen,Joe Morton,S. Epatha Merkerson,Castulo Guerra,Danny Cooksey,Jenette Goldstein,Xander Berkeley,Leslie Hamilton Gearren,Ken Gibbel,Robert Winley,Peter Schrum,Shane Wilder,Michael Edwards,Jared Lounsbery",United States,"English,Spanish"
Le pianiste,Original title: The Pianist,2002,Tous publics,"2,h, ,30,m",8.5,"Biography,Drama,Music",A Polish Jewish musician struggles to survive the destruction of the Warsaw ghetto of World War II.,"Adrien Brody,Thomas Kretschmann,Frank Finlay,Emilia Fox,Michal Zebrowski,Ed Stoppard,Maureen Lipman,Jessica Kate Meyer,Julia Rayner,Wanja Mues,Richard Ridings,Nomi Sharron,Anthony Milner,Lucy Skeaping,Roddy Skeaping,Ben Harlan,Thomas Lawinky,Joachim Paul Assböck",United Kingdom,"English,German,Russian"
Harakiri,Original title: Seppuku,1962,Tous publics,"2,h, ,13,m",8.6,"Action,Drama,Mystery","When a ronin requesting seppuku at a feudal lord's palace is told of the brutal suicide of another ronin who previously visited, he reveals how their pasts are intertwined - and in doing so challenges the clan's integrity.","Tatsuya Nakadai,Akira Ishihama,Shima Iwashita,Tetsurô Tanba,Masao Mishima,Ichirô Nakatani,Kei Satô,Yoshio Inaba,Hisashi Igawa,Tôru Takeuchi,Yoshirô Aoki,Tatsuo Matsumura,Akiji Kobayashi,Kôichi Hayashi,Ryûtarô Gomi,Jô Azumi,Nakajirô Tomita,Shichisaburô Amatsu",Japan,Japanese
Léon,,1994,12,"1,h, ,50,m",8.5,"Action,Crime,Drama","Mathilda, a 12-year-old girl, is reluctantly taken in by Léon, a professional assassin, after her family is murdered. An unusual relationship forms as she becomes his protégée and learns the assassin's trade.","Jean Reno,Gary Oldman,Natalie Portman,Danny Aiello,Peter Appel,Willi One Blood,Don Creech,Keith A. Glascoe,Randolph Scott,Michael Badalucco,Ellen Greene,Elizabeth Regen,Carl J. Matusovich,Frank Senger,Lucius Wyatt Cherokee,Eric Challier,Luc Bernard,Maïwenn",France,"English,Italian,French"
Parasite,Original title: Gisaengchung,2019,Tous publics avec avertissement,"2,h, ,12,m",8.6,"Comedy,Drama,Thriller",Greed and class discrimination threaten the newly formed symbiotic relationship between the wealthy Park family and the destitute Kim clan.,"Kang-ho Song,Sun-kyun Lee,Yeo-jeong Cho,Woo-sik Choi,So-dam Park,Lee Jeong-eun,Jang Hye-jin,Park Myeong-hoon,Ji-so Jung,Hyun-jun Jung,Keun-rok Park,Yi-Seo Jung,Jae-myeong Jo,Ik-han Jung,Kyu-baek Kim,Hwang In Kyung,Ahn Seong-Bong,Kim Jin Hyung",South Korea,"Korean,English"
La ligne verte,Original title: The Green Mile,1999,12,"3,h, ,9,m",8.6,"Crime,Drama,Fantasy","The lives of guards on Death Row are affected by one of their charges: a black man accused of child murder and rape, yet who has a mysterious gift.","Tom Hanks,Michael Clarke Duncan,David Morse,Bonnie Hunt,James Cromwell,Michael Jeter,Graham Greene,Doug Hutchison,Sam Rockwell,Barry Pepper,Jeffrey DeMunn,Patricia Clarkson,Harry Dean Stanton,Dabbs Greer,Eve Brent,William Sadler,Mack Miles,Rai Tasco",United States,"English,French"
Le voyage de Chihiro,Original title: Sen to Chihiro no kamikakushi,2001,Tous publics,"2,h, ,5,m",8.6,"Animation,Adventure,Family","During her family's move to the suburbs, a sullen 10-year-old girl wanders into a world ruled by gods, witches, and spirits, and where humans are changed into beasts.","Daveigh Chase,Suzanne Pleshette,Miyu Irino,Rumi Hiiragi,Mari Natsuki,Takashi Naitô,Yasuko Sawaguchi,Tatsuya Gashûin,Ryûnosuke Kamiki,Yumi Tamai,Yô Ôizumi,Koba Hayashi,Tsunehiko Kamijô,Takehiko Ono,Bunta Sugawara,Shigeru Wakita,Shirô Saitô,Michiko Yamamoto",Japan,"Japanese,English"
Interstellar,,2014,Tous publics,"2,h, ,49,m",8.6,"Adventure,Drama,Sci-Fi",A team of explorers travel through a wormhole in space in an attempt to ensure humanity's survival.,"Matthew McConaughey,Anne Hathaway,Jessica Chastain,Mackenzie Foy,Ellen Burstyn,John Lithgow,Timothée Chalamet,David Oyelowo,Collette Wolfe,Francis X. McCarthy,Bill Irwin,Andrew Borba,Wes Bentley,William Devane,Michael Caine,David Gyasi,Josh Stewart,Casey Affleck",United Kingdom,English
Il faut sauver le soldat Ryan,Original title: Saving Private Ryan,1998,Tous publics avec avertissement,"2,h, ,49,m",8.6,"Drama,War","Following the Normandy Landings, a group of U.S. soldiers go behind enemy lines to retrieve a paratrooper whose brothers have been killed in action.","Tom Hanks,Matt Damon,Tom Sizemore,Edward Burns,Barry Pepper,Adam Goldberg,Vin Diesel,Giovanni Ribisi,Jeremy Davies,Ted Danson,Paul Giamatti,Dennis Farina,Joerg Stadler,Max Martini,Dylan Bruno,Daniel Cerqueira,Demetri Goritsas,Ian Porter",United States,"English,French,German,Czech"
La guerre des étoiles,Original title: Star Wars,1977,Tous publics,"2,h, ,1,m",8.6,"Action,Adventure,Fantasy","Luke Skywalker joins forces with a Jedi Knight, a cocky pilot, a Wookiee and two droids to save the galaxy from the Empire's world-destroying battle station, while also attempting to rescue Princess Leia from the mysterious Darth Vader.","Mark Hamill,Harrison Ford,Carrie Fisher,Alec Guinness,Peter Cushing,Anthony Daniels,Kenny Baker,Peter Mayhew,David Prowse,Phil Brown,Shelagh Fraser,Jack Purvis,Alex McCrindle,Eddie Byrne,Drewe Henley,Denis Lawson,Garrick Hagon,Jack Klaff",United States,English
La vie est belle,Original title: It's a Wonderful Life,1946,Tous publics,"2,h, ,10,m",8.6,"Drama,Family,Fantasy",An angel is sent from Heaven to help a desperately frustrated businessman by showing him what life would have been like if he had never existed.,"James Stewart,Donna Reed,Lionel Barrymore,Thomas Mitchell,Henry Travers,Beulah Bondi,Frank Faylen,Ward Bond,Gloria Grahame,H.B. Warner,Frank Albertson,Todd Karns,Samuel S. Hinds,Mary Treen,Virginia Patton,Charles Williams,Sarah Edwards,William Edmunds",United States,"English,French"
La vie est belle,Original title: La vita è bella,1997,Tous publics,"1,h, ,56,m",8.6,"Comedy,Drama,Romance","When an open-minded Jewish waiter and his son become victims of the Holocaust, he uses a perfect mixture of will, humor, and imagination to protect his son from the dangers around their camp.","Roberto Benigni,Nicoletta Braschi,Giorgio Cantarini,Giustino Durano,Sergio Bini Bustric,Marisa Paredes,Horst Buchholz,Lidia Alfonsi,Giuliana Lojodice,Amerigo Fontani,Pietro De Silva,Francesco Guzzo,Raffaella Lebboroni,Claudio Alfonsi,Gil Baroni,Massimo Bianchi,Jürgen Bohn,Verena Buratti",Italy,"Italian,German,English"
La Cité de Dieu,Original title: Cidade de Deus,2002,16,"2,h, ,10,m",8.6,"Crime,Drama","In the slums of Rio, two kids' paths diverge as one struggles to become a photographer and the other a kingpin.","Alexandre Rodrigues,Leandro Firmino,Matheus Nachtergaele,Phellipe Haagensen,Douglas Silva,Jonathan Haagensen,Seu Jorge,Jefechander Suplino,Alice Braga,Emerson Gomes,Edson Oliveira,Michel Gomes,Roberta Rodrigues,Luis Otávio,Kiko Marques,Gustavo Engrácia,Darlan Cunha,Robson Rocha",Brazil,Portuguese
Le Silence des agneaux,Original title: The Silence of the Lambs,1991,16,"1,h, ,58,m",8.6,"Crime,Drama,Thriller","A young F.B.I. cadet must receive the help of an incarcerated and manipulative cannibal killer to help catch another serial killer, a madman who skins his victims.","Jodie Foster,Anthony Hopkins,Lawrence A. Bonney,Kasi Lemmons,Lawrence T. Wrentz,Scott Glenn,Anthony Heald,Frankie Faison,Don Brockett,Frank Seals Jr.,Stuart Rudin,Maria Skorobogatov,Jeffrie Lane,Leib Lensky,George 'Red' Schwartz,Jim Roche,Brooke Smith,Ted Levine",United States,"English,Latin"
Seven,Original title: Se7en,1995,12,"2,h, ,7,m",8.6,"Crime,Drama,Mystery","Two detectives, a rookie and a veteran, hunt a serial killer who uses the seven deadly sins as his motives.","Morgan Freeman,Brad Pitt,Kevin Spacey,Andrew Kevin Walker,Daniel Zacapa,Gwyneth Paltrow,John Cassini,Bob Mack,Peter Crombie,Reg E. Cathey,R. Lee Ermey,George Christy,Endre Hules,Hawthorne James,William Davidson,Bob Collins,Jimmy Dale Hartsell,Richard Roundtree",United States,English
Les 7 Samouraïs,Original title: Shichinin no samurai,1954,Tous publics,"3,h, ,27,m",8.6,"Action,Adventure,Drama",A poor village under attack by bandits recruits seven unemployed samurai to help them defend themselves.,"Toshirô Mifune,Takashi Shimura,Keiko Tsushima,Yukiko Shimazaki,Kamatari Fujiwara,Daisuke Katô,Isao Kimura,Minoru Chiaki,Seiji Miyaguchi,Yoshio Kosugi,Bokuzen Hidari,Yoshio Inaba,Yoshio Tsuchiya,Kokuten Kôdô,Eijirô Tôno,Kichijirô Ueda,Jun Tatara,Atsushi Watanabe",Japan,Japanese
Vol au-dessus d'un nid de coucou,Original title: One Flew Over the Cuckoo's Nest,1975,Tous publics avec avertissement,"2,h, ,13,m",8.7,Drama,"A criminal pleads insanity and is admitted to a mental institution, where he rebels against the oppressive nurse and rallies up the scared patients.","Jack Nicholson,Louise Fletcher,Michael Berryman,Peter Brocco,Dean R. Brooks,Alonzo Brown,Scatman Crothers,Mwako Cumbuka,Danny DeVito,William Duell,Josip Elic,Lan Fendors,Nathan George,Ken Kenny,Mel Lambert,Sydney Lassick,Kay Lee,Christopher Lloyd",United States,English
Les affranchis,Original title: Goodfellas,1990,16,"2,h, ,26,m",8.7,"Biography,Crime,Drama","The story of Henry Hill and his life in the mob, covering his relationship with his wife Karen Hill and his mob partners Jimmy Conway and Tommy DeVito in the Italian-American crime syndicate.","Robert De Niro,Ray Liotta,Joe Pesci,Lorraine Bracco,Paul Sorvino,Frank Sivero,Tony Darrow,Mike Starr,Frank Vincent,Chuck Low,Frank DiLeo,Henny Youngman,Gina Mastrogiacomo,Catherine Scorsese,Charles Scorsese,Suzanne Shepherd,Debi Mazar,Margo Winkler",United States,"English,Italian"
Matrix,Original title: The Matrix,1999,Tous publics avec avertissement,"2,h, ,16,m",8.7,"Action,Sci-Fi","When a beautiful stranger leads computer hacker Neo to a forbidding underworld, he discovers the shocking truth--the life he knows is the elaborate deception of an evil cyber-intelligence.","Keanu Reeves,Laurence Fishburne,Carrie-Anne Moss,Hugo Weaving,Gloria Foster,Joe Pantoliano,Marcus Chong,Julian Arahanga,Matt Doran,Belinda McClory,Anthony Ray Parker,Paul Goddard,Robert Taylor,David Aston,Marc Aden Gray,Ada Nicodemou,Deni Gordon,Rowan Witt",United States,English
L'Empire contre-attaque,Original title: Star Wars: Episode V - The Empire Strikes Back,1980,Tous publics,"2,h, ,4,m",8.7,"Action,Adventure,Fantasy","After the Rebels are brutally overpowered by the Empire on the ice planet Hoth, Luke Skywalker begins Jedi training with Yoda, while his friends are pursued across the galaxy by Darth Vader and bounty hunter Boba Fett.","Mark Hamill,Harrison Ford,Carrie Fisher,Billy Dee Williams,Anthony Daniels,David Prowse,Peter Mayhew,Kenny Baker,Frank Oz,Alec Guinness,Jeremy Bulloch,John Hollis,Jack Purvis,Des Webb,Clive Revill,Kenneth Colley,Julian Glover,Michael Sheard",United States,English
Le Seigneur des anneaux : Les Deux Tours,Original title: The Lord of the Rings: The Two Towers,2002,Tous publics,"2,h, ,59,m",8.7,"Action,Adventure,Drama","While Frodo and Sam edge closer to Mordor with the help of the shifty Gollum, the divided fellowship makes a stand against Sauron's new ally, Saruman, and his hordes of Isengard.","Elijah Wood,Ian McKellen,Viggo Mortensen,Orlando Bloom,Bruce Allpress,Sean Astin,John Bach,Sala Baker,Cate Blanchett,Billy Boyd,Jed Brophy,Sam Comery,Brad Dourif,Calum Gittins,Bernard Hill,Bruce Hopkins,Paris Howe Strewe,Christopher Lee",New Zealand,"English,Sindarin,Old English"
Inception,,2010,Tous publics,"2,h, ,28,m",8.8,"Action,Adventure,Sci-Fi","A thief who steals corporate secrets through the use of dream-sharing technology is given the inverse task of planting an idea into the mind of a C.E.O., but his tragic past may doom the project and his team to disaster.","Leonardo DiCaprio,Joseph Gordon-Levitt,Elliot Page,Ken Watanabe,Tom Hardy,Dileep Rao,Cillian Murphy,Tom Berenger,Marion Cotillard,Pete Postlethwaite,Michael Caine,Lukas Haas,Tai-Li Lee,Claire Geare,Magnus Nolan,Taylor Geare,Johnathan Geare,Tohoru Masamune",United Kingdom,"English,Japanese,French"
